{
  "dungeon_mask_count": 14,
  "dungeon_masks": [
    {
      "entry_file_offset": 296396,
      "expression": "$8000",
      "literal_value": 32768,
      "source_label": ".item_masks",
      "table_index": 0
    },
    {
      "entry_file_offset": 296398,
      "expression": "$4000",
      "literal_value": 16384,
      "source_label": ".item_masks",
      "table_index": 1
    },
    {
      "entry_file_offset": 296400,
      "expression": "$2000",
      "literal_value": 8192,
      "source_label": ".item_masks",
      "table_index": 2
    },
    {
      "entry_file_offset": 296402,
      "expression": "$1000",
      "literal_value": 4096,
      "source_label": ".item_masks",
      "table_index": 3
    },
    {
      "entry_file_offset": 296404,
      "expression": "$0800",
      "literal_value": 2048,
      "source_label": ".item_masks",
      "table_index": 4
    },
    {
      "entry_file_offset": 296406,
      "expression": "$0400",
      "literal_value": 1024,
      "source_label": ".item_masks",
      "table_index": 5
    },
    {
      "entry_file_offset": 296408,
      "expression": "$0200",
      "literal_value": 512,
      "source_label": ".item_masks",
      "table_index": 6
    },
    {
      "entry_file_offset": 296410,
      "expression": "$0100",
      "literal_value": 256,
      "source_label": ".item_masks",
      "table_index": 7
    },
    {
      "entry_file_offset": 296412,
      "expression": "$0080",
      "literal_value": 128,
      "source_label": ".item_masks",
      "table_index": 8
    },
    {
      "entry_file_offset": 296414,
      "expression": "$0040",
      "literal_value": 64,
      "source_label": ".item_masks",
      "table_index": 9
    },
    {
      "entry_file_offset": 296416,
      "expression": "$0020",
      "literal_value": 32,
      "source_label": ".item_masks",
      "table_index": 10
    },
    {
      "entry_file_offset": 296418,
      "expression": "$0010",
      "literal_value": 16,
      "source_label": ".item_masks",
      "table_index": 11
    },
    {
      "entry_file_offset": 296420,
      "expression": "$0008",
      "literal_value": 8,
      "source_label": ".item_masks",
      "table_index": 12
    },
    {
      "entry_file_offset": 296422,
      "expression": "$0004",
      "literal_value": 4,
      "source_label": ".item_masks",
      "table_index": 13
    }
  ],
  "entries": [
    {
      "item_value": {
        "entry_file_offset": 296320,
        "expression": "$01",
        "literal_value": 1,
        "source_label": ".item_values"
      },
      "properties": {
        "entry_file_offset": 296092,
        "expression": "5",
        "literal_value": 5,
        "source_label": ".properties"
      },
      "table_index": 0,
      "target_address": {
        "entry_file_offset": 296168,
        "expression": "$F359",
        "literal_value": 62297,
        "source_label": ".item_target_addr"
      },
      "wide_item_flag": {
        "entry_file_offset": 296016,
        "expression": "$00",
        "literal_value": 0,
        "source_label": ".wide_item_flag"
      },
      "x_offset": {
        "entry_file_offset": 295864,
        "expression": "4",
        "literal_value": 4,
        "source_label": ".x_offsets"
      },
      "y_offset": {
        "entry_file_offset": 295788,
        "expression": "-5",
        "literal_value": null,
        "source_label": ".y_offsets"
      }
    },
    {
      "item_value": {
        "entry_file_offset": 296321,
        "expression": "$02",
        "literal_value": 2,
        "source_label": ".item_values"
      },
      "properties": {
        "entry_file_offset": 296093,
        "expression": "-1",
        "literal_value": null,
        "source_label": ".properties"
      },
      "table_index": 1,
      "target_address": {
        "entry_file_offset": 296170,
        "expression": "$F359",
        "literal_value": 62297,
        "source_label": ".item_target_addr"
      },
      "wide_item_flag": {
        "entry_file_offset": 296017,
        "expression": "$00",
        "literal_value": 0,
        "source_label": ".wide_item_flag"
      },
      "x_offset": {
        "entry_file_offset": 295865,
        "expression": "4",
        "literal_value": 4,
        "source_label": ".x_offsets"
      },
      "y_offset": {
        "entry_file_offset": 295789,
        "expression": "-5",
        "literal_value": null,
        "source_label": ".y_offsets"
      }
    },
    {
      "item_value": {
        "entry_file_offset": 296322,
        "expression": "$03",
        "literal_value": 3,
        "source_label": ".item_values"
      },
      "properties": {
        "entry_file_offset": 296094,
        "expression": "5",
        "literal_value": 5,
        "source_label": ".properties"
      },
      "table_index": 2,
      "target_address": {
        "entry_file_offset": 296172,
        "expression": "$F359",
        "literal_value": 62297,
        "source_label": ".item_target_addr"
      },
      "wide_item_flag": {
        "entry_file_offset": 296018,
        "expression": "$00",
        "literal_value": 0,
        "source_label": ".wide_item_flag"
      },
      "x_offset": {
        "entry_file_offset": 295866,
        "expression": "4",
        "literal_value": 4,
        "source_label": ".x_offsets"
      },
      "y_offset": {
        "entry_file_offset": 295790,
        "expression": "-5",
        "literal_value": null,
        "source_label": ".y_offsets"
      }
    },
    {
      "item_value": {
        "entry_file_offset": 296323,
        "expression": "$04",
        "literal_value": 4,
        "source_label": ".item_values"
      },
      "properties": {
        "entry_file_offset": 296095,
        "expression": "5",
        "literal_value": 5,
        "source_label": ".properties"
      },
      "table_index": 3,
      "target_address": {
        "entry_file_offset": 296174,
        "expression": "$F359",
        "literal_value": 62297,
        "source_label": ".item_target_addr"
      },
      "wide_item_flag": {
        "entry_file_offset": 296019,
        "expression": "$00",
        "literal_value": 0,
        "source_label": ".wide_item_flag"
      },
      "x_offset": {
        "entry_file_offset": 295867,
        "expression": "4",
        "literal_value": 4,
        "source_label": ".x_offsets"
      },
      "y_offset": {
        "entry_file_offset": 295791,
        "expression": "-5",
        "literal_value": null,
        "source_label": ".y_offsets"
      }
    },
    {
      "item_value": {
        "entry_file_offset": 296324,
        "expression": "$01",
        "literal_value": 1,
        "source_label": ".item_values"
      },
      "properties": {
        "entry_file_offset": 296096,
        "expression": "5",
        "literal_value": 5,
        "source_label": ".properties"
      },
      "table_index": 4,
      "target_address": {
        "entry_file_offset": 296176,
        "expression": "$F35A",
        "literal_value": 62298,
        "source_label": ".item_target_addr"
      },
      "wide_item_flag": {
        "entry_file_offset": 296020,
        "expression": "$00",
        "literal_value": 0,
        "source_label": ".wide_item_flag"
      },
      "x_offset": {
        "entry_file_offset": 295868,
        "expression": "4",
        "literal_value": 4,
        "source_label": ".x_offsets"
      },
      "y_offset": {
        "entry_file_offset": 295792,
        "expression": "-5",
        "literal_value": null,
        "source_label": ".y_offsets"
      }
    },
    {
      "item_value": {
        "entry_file_offset": 296325,
        "expression": "$02",
        "literal_value": 2,
        "source_label": ".item_values"
      },
      "properties": {
        "entry_file_offset": 296097,
        "expression": "5",
        "literal_value": 5,
        "source_label": ".properties"
      },
      "table_index": 5,
      "target_address": {
        "entry_file_offset": 296178,
        "expression": "$F35A",
        "literal_value": 62298,
        "source_label": ".item_target_addr"
      },
      "wide_item_flag": {
        "entry_file_offset": 296021,
        "expression": "$02",
        "literal_value": 2,
        "source_label": ".wide_item_flag"
      },
      "x_offset": {
        "entry_file_offset": 295869,
        "expression": "0",
        "literal_value": 0,
        "source_label": ".x_offsets"
      },
      "y_offset": {
        "entry_file_offset": 295793,
        "expression": "-4",
        "literal_value": null,
        "source_label": ".y_offsets"
      }
    },
    {
      "item_value": {
        "entry_file_offset": 296326,
        "expression": "$03",
        "literal_value": 3,
        "source_label": ".item_values"
      },
      "properties": {
        "entry_file_offset": 296098,
        "expression": "5",
        "literal_value": 5,
        "source_label": ".properties"
      },
      "table_index": 6,
      "target_address": {
        "entry_file_offset": 296180,
        "expression": "$F35A",
        "literal_value": 62298,
        "source_label": ".item_target_addr"
      },
      "wide_item_flag": {
        "entry_file_offset": 296022,
        "expression": "$02",
        "literal_value": 2,
        "source_label": ".wide_item_flag"
      },
      "x_offset": {
        "entry_file_offset": 295870,
        "expression": "0",
        "literal_value": 0,
        "source_label": ".x_offsets"
      },
      "y_offset": {
        "entry_file_offset": 295794,
        "expression": "-4",
        "literal_value": null,
        "source_label": ".y_offsets"
      }
    },
    {
      "item_value": {
        "entry_file_offset": 296327,
        "expression": "$01",
        "literal_value": 1,
        "source_label": ".item_values"
      },
      "properties": {
        "entry_file_offset": 296099,
        "expression": "1",
        "literal_value": 1,
        "source_label": ".properties"
      },
      "table_index": 7,
      "target_address": {